{
  "cases": [
    {
      "expected_output": {
        "path": "2025-05H-55.out",
        "sha256": "7bb6550855bcc56b09b15e2406ab6499e33ef1df5041b513307336e854efbdfd",
        "size_bytes": 11
      },
      "family": "2025-05H",
      "id": "rv64gc:2025-05H-55",
      "input": {
        "path": "2025-05H-55.in",
        "sha256": "58aa89290034d5f302a0cc354cef6ffde3fad0462af29dae15fb5527b53c6edc",
        "size_bytes": 307946
      },
      "provenance": {
        "data_role": "B3",
        "derived_from": null,
        "license": {
          "spdx_expression": "NOASSERTION"
        },
        "origin": {
          "snapshot_sha256": "91d1940672d1bd76dd4fc3953a896adcfd7a6f5303a0771218bcf9a9af4b27d6",
          "source_id": "official-compiler2025:riscv-performance-final"
        },
        "validity": {
          "reason": "verified",
          "status": "included"
        }
      },
      "source": {
        "path": "2025-05H-55.sy",
        "sha256": "524915a9ff9bf479a3e500bdd271566d626ed3b5dd94707be103019f2fd7225f",
        "size_bytes": 1555
      },
      "source_group": "sg-524915a9ff9bf479a3e500bdd271566d626ed3b5dd94707be103019f2fd7225f",
      "tags": [],
      "target": "rv64gc",
      "weight": 1.0
    },
    {
      "expected_output": {
        "path": "2025-0XT-12.out",
        "sha256": "6d764fd859d2a07c5e06aa6d472837616bddd0ad9743a90547567ca6385ecb6e",
        "size_bytes": 1980
      },
      "family": "2025-0XT",
      "id": "rv64gc:2025-0XT-12",
      "input": {
        "path": "2025-0XT-12.in",
        "sha256": "b0699ac9ad9290780b59b3b2724ed16d306f4a4e69c3865c966ece49369ab425",
        "size_bytes": 6
      },
      "provenance": {
        "data_role": "B3",
        "derived_from": null,
        "license": {
          "spdx_expression": "NOASSERTION"
        },
        "origin": {
          "snapshot_sha256": "91d1940672d1bd76dd4fc3953a896adcfd7a6f5303a0771218bcf9a9af4b27d6",
          "source_id": "official-compiler2025:riscv-performance-final"
        },
        "validity": {
          "reason": "verified",
          "status": "included"
        }
      },
      "source": {
        "path": "2025-0XT-12.sy",
        "sha256": "284f82760dcb6b325ec0752b1f9802ef33160c78d0b6f7e1785244f9b8acaa52",
        "size_bytes": 903
      },
      "source_group": "sg-284f82760dcb6b325ec0752b1f9802ef33160c78d0b6f7e1785244f9b8acaa52",
      "tags": [],
      "target": "rv64gc",
      "weight": 1.0
    },
    {
      "expected_output": {
        "path": "2025-18P-6.out",
        "sha256": "ef47844832b5375d7f0f66796b782ecb74dd748260994c020530f64149ddd9fe",
        "size_bytes": 11
      },
      "family": "2025-18P",
      "id": "rv64gc:2025-18P-6",
      "input": {
        "path": "2025-18P-6.in",
        "sha256": "98a1e72597ca31a3e6ad14fefd673b3152ade1057c6bb7f6fc9eedb41cd5ba13",
        "size_bytes": 6
      },
      "provenance": {
        "data_role": "B3",
        "derived_from": null,
        "license": {
          "spdx_expression": "NOASSERTION"
        },
        "origin": {
          "snapshot_sha256": "91d1940672d1bd76dd4fc3953a896adcfd7a6f5303a0771218bcf9a9af4b27d6",
          "source_id": "official-compiler2025:riscv-performance-final"
        },
        "validity": {
          "reason": "verified",
          "status": "included"
        }
      },
      "source": {
        "path": "2025-18P-6.sy",
        "sha256": "5af4f29ec1cb74f1aae1e2004766dd6a28a36a3951c6e966abba9d5d5387c302",
        "size_bytes": 441
      },
      "source_group": "sg-5af4f29ec1cb74f1aae1e2004766dd6a28a36a3951c6e966abba9d5d5387c302",
      "tags": [],
      "target": "rv64gc",
      "weight": 1.0
    },
    {
      "expected_output": {
        "path": "2025-1NE-37.out",
        "sha256": "bc3fc67344a60c33db00f41d0c45f2ef4098a06d44eda17362425d130e6426be",
        "size_bytes": 12
      },
      "family": "2025-1NE",
      "id": "rv64gc:2025-1NE-37",
      "input": {
        "path": "2025-1NE-37.in",
        "sha256": "6980ea58027d0c8a82269dcdf0a14a006fdb04b7584e5b8b67c278f5aa8d541a",
        "size_bytes": 7
      },
      "provenance": {
        "data_role": "B3",
        "derived_from": null,
        "license": {
          "spdx_expression": "NOASSERTION"
        },
        "origin": {
          "snapshot_sha256": "91d1940672d1bd76dd4fc3953a896adcfd7a6f5303a0771218bcf9a9af4b27d6",
          "source_id": "official-compiler2025:riscv-performance-final"
        },
        "validity": {
          "reason": "verified",
          "status": "included"
        }
      },
      "source": {
        "path": "2025-1NE-37.sy",
        "sha256": "89b3115d489b4735adcecc5881356f763f1a4d6d1e20c6c3fba7b18b41bcf851",
        "size_bytes": 3234
      },
      "source_group": "sg-89b3115d489b4735adcecc5881356f763f1a4d6d1e20c6c3fba7b18b41bcf851",
      "tags": [],
      "target": "rv64gc",
      "weight": 1.0
    },
    {
      "expected_output": {
        "path": "2025-236-50.out",
        "sha256": "8ec1066f64b7157653f366d734c09287ab8961cb2a758ea5dcd5795d97edd33c",
        "size_bytes": 178
      },
      "family": "2025-236",
      "id": "rv64gc:2025-236-50",
      "input": {
        "path": "2025-236-50.in",
        "sha256": "306464ea0dafbdcf5268691b4fe4d0d9d992f0d02846ac9600b2d0137cae7b84",
        "size_bytes": 3866
      },
      "provenance": {
        "data_role": "B3",
        "derived_from": null,
        "license": {
          "spdx_expression": "NOASSERTION"
        },
        "origin": {
          "snapshot_sha256": "91d1940672d1bd76dd4fc3953a896adcfd7a6f5303a0771218bcf9a9af4b27d6",
          "source_id": "official-compiler2025:riscv-performance-final"
        },
        "validity": {
          "reason": "verified",
          "status": "included"
        }
      },
      "source": {
        "path": "2025-236-50.sy",
        "sha256": "2f17f5266d27918252b6739e1d70dbf3758228d1bd8326b473e5dc8147d3693a",
        "size_bytes": 3029
      },
      "source_group": "sg-2f17f5266d27918252b6739e1d70dbf3758228d1bd8326b473e5dc8147d3693a",
      "tags": [],
      "target": "rv64gc",
      "weight": 1.0
    },
    {
      "expected_output": {
        "path": "2025-2EI-3.out",
        "sha256": "79be94021cb4fea77c75e475ac5b9c7af312e1cc51704648424df6543da5e579",
        "size_bytes": 3720
      },
      "family": "2025-2EI",
      "id": "rv64gc:2025-2EI-3",
      "input": {
        "path": "2025-2EI-3.in",
        "sha256": "1570b6d5f67b17ae6f5b4213858de24e8654aed59d1f85c6d7d38f1f8952f862",
        "size_bytes": 854277
      },
      "provenance": {
        "data_role": "B3",
        "derived_from": null,
        "license": {
          "spdx_expression": "NOASSERTION"
        },
        "origin": {
          "snapshot_sha256": "91d1940672d1bd76dd4fc3953a896adcfd7a6f5303a0771218bcf9a9af4b27d6",
          "source_id": "official-compiler2025:riscv-performance-final"
        },
        "validity": {
          "reason": "verified",
          "status": "included"
        }
      },
      "source": {
        "path": "2025-2EI-3.sy",
        "sha256": "06a9862e606589bd60db35172b809cd8a6ffb67f86f752d65189a1f4707f1e40",
        "size_bytes": 1936
      },
      "source_group": "sg-06a9862e606589bd60db35172b809cd8a6ffb67f86f752d65189a1f4707f1e40",
      "tags": [],
      "target": "rv64gc",
      "weight": 1.0
    },
    {
      "expected_output": {
        "path": "2025-3F1-17.out",
        "sha256": "eebe930ef602c2e7c253ebbec4eae50f4fd616f1da19031e8e3d9ca418c8bda6",
        "size_bytes": 24424
      },
      "family": "2025-3F1",
      "id": "rv64gc:2025-3F1-17",
      "input": {
        "path": "2025-3F1-17.in",
        "sha256": "d8b9622e86cde748b1fd646005a8d54ab393137e3f170e631ced2b0ca7ddb6d1",
        "size_bytes": 15
      },
      "provenance": {
        "data_role": "B3",
        "derived_from": null,
        "license": {
          "spdx_expression": "NOASSERTION"
        },
        "origin": {
          "snapshot_sha256": "91d1940672d1bd76dd4fc3953a896adcfd7a6f5303a0771218bcf9a9af4b27d6",
          "source_id": "official-compiler2025:riscv-performance-final"
        },
        "validity": {
          "reason": "verified",
          "status": "included"
        }
      },
      "source": {
        "path": "2025-3F1-17.sy",
        "sha256": "35ca1a66e2b6389a1faefd280dc20c568e1a048cca9aa010ca2201c6f154b824",
        "size_bytes": 1942
      },
      "source_group": "sg-35ca1a66e2b6389a1faefd280dc20c568e1a048cca9aa010ca2201c6f154b824",
      "tags": [],
      "target": "rv64gc",
      "weight": 1.0
    },
    {
      "expected_output": {
        "path": "2025-3ZC-30.out",
        "sha256": "3c87d0120b5104ac868ce76174c887cb167af4e905ee99c73434a13050f5b1ea",
        "size_bytes": 5
      },
      "family": "2025-3ZC",
      "id": "rv64gc:2025-3ZC-30",
      "input": {
        "path": "2025-3ZC-30.in",
        "sha256": "1b26a97ed20d3ae3190157d761fed57bcdee3ab3aab4e02da6aab1fe5cf80403",
        "size_bytes": 154
      },
      "provenance": {
        "data_role": "B3",
        "derived_from": null,
        "license": {
          "spdx_expression": "NOASSERTION"
        },
        "origin": {
          "snapshot_sha256": "91d1940672d1bd76dd4fc3953a896adcfd7a6f5303a0771218bcf9a9af4b27d6",
          "source_id": "official-compiler2025:riscv-performance-final"
        },
        "validity": {
          "reason": "verified",
          "status": "included"
        }
      },
      "source": {
        "path": "2025-3ZC-30.sy",
        "sha256": "175f853fefa2d6126473dc544b4c8fccb5cf9681ec84f977a1e54a441f39b8e3",
        "size_bytes": 744
      },
      "source_group": "sg-175f853fefa2d6126473dc544b4c8fccb5cf9681ec84f977a1e54a441f39b8e3",
      "tags": [],
      "target": "rv64gc",
      "weight": 1.0
    },
    {
      "expected_output": {
        "path": "2025-67P-14.out",
        "sha256": "daa75e946eede6f3b16099c33dbf03ec81cda08d6bdfc41ed49576ea2e8f1400",
        "size_bytes": 5
      },
      "family": "2025-67P",
      "id": "rv64gc:2025-67P-14",